{
  "$schema": "../../schema/canonical-node.schema.json",
  "constrainedBy": [
    "audience.role.*"
  ],
  "id": "context.a-report-longer-than-the-reader-acts-on-is-skipped",
  "level": "context",
  "schemaVersion": 1,
  "statement": "An engineer stops reading a tool that reports more than they can act on.",
  "sync": {
    "constraintsDigest": "sha256:product-lint-constraints-v1:d1f2cf43f965ad01c6d7c3b798d9ee4e474c4879c578688afa3f40c7c7a28d4a"
  }
}
