{
  "$schema": "../../schema/canonical-node.schema.json",
  "constrainedBy": [
    "behavior.an-unowned-file-refuses-the-commit",
    "behavior.two-owners-for-one-file-refuse-the-commit"
  ],
  "id": "architecture.only-the-deepest-level-binds-to-files",
  "level": "architecture",
  "schemaVersion": 1,
  "statement": "Only the deepest level binds to files, so file ownership has exactly one place to be resolved.",
  "sync": {
    "constraintsDigest": "sha256:product-lint-constraints-v1:e7308cdae72e0742e0a44c3630603dc6dba7d1c27b7a3d2b4ad613c3a34e5d17"
  }
}
