{
  "$schema": "../../schema/canonical-node.schema.json",
  "constrainedBy": [
    "audience.role.*"
  ],
  "id": "context.one-word-carries-two-meanings",
  "level": "context",
  "schemaVersion": 1,
  "statement": "Two engineers use one word for two things, or two words for one thing.",
  "sync": {
    "constraintsDigest": "sha256:product-lint-constraints-v1:d1f2cf43f965ad01c6d7c3b798d9ee4e474c4879c578688afa3f40c7c7a28d4a"
  }
}
