{
  "$schema": "../../schema/canonical-node.schema.json",
  "constrainedBy": [
    "behavior.naming-a-file-lists-its-lineage"
  ],
  "id": "architecture.the-graph-layer-owns-lineage",
  "level": "architecture",
  "schemaVersion": 1,
  "statement": "The graph layer owns lineage, so no other layer walks parents to answer what governs a file.",
  "sync": {
    "constraintsDigest": "sha256:product-lint-constraints-v1:25ee7876c1bca7007ee9c68bde6ff1ddd07cd6c9d4924b9cac7d56db7458cec1"
  }
}
