{
  "$schema": "../../schema/canonical-node.schema.json",
  "constrainedBy": [
    "audience.role.*"
  ],
  "id": "context.code-changes-and-its-claim-does-not",
  "level": "context",
  "schemaVersion": 1,
  "statement": "An engineer changes code and leaves the claim it implements saying something else.",
  "sync": {
    "constraintsDigest": "sha256:product-lint-constraints-v1:d1f2cf43f965ad01c6d7c3b798d9ee4e474c4879c578688afa3f40c7c7a28d4a"
  }
}
