{
  "$schema": "../../schema/canonical-node.schema.json",
  "constrainedBy": [
    "architecture.one-index-resolves-every-marked-word"
  ],
  "id": "mechanism.the-vocabulary-index",
  "implementation": {
    "digest": "sha256:product-lint-implementation-v1:916fd38b0229f02c97699ebe9a41699e04905dfca659eedef98f64b52417bd73",
    "files": [
      "src/terms.ts",
      "src/vocabulary.ts",
      "test/vocabulary.test.mjs"
    ]
  },
  "level": "mechanism",
  "schemaVersion": 1,
  "statement": "The terms and vocabulary modules implement declaring a name and resolving a mark.",
  "sync": {
    "constraintsDigest": "sha256:product-lint-constraints-v1:9352e419063e00182f929e23b34409faa3eeef90221e77941546466de4335d9a"
  }
}
