{
  "$schema": "../../schema/canonical-node.schema.json",
  "constrainedBy": [
    "product.the-existing-decisions-are-shown-before-another-is-added"
  ],
  "id": "behavior.a-request-for-a-node-carries-the-level-and-the-words",
  "level": "behavior",
  "schemaVersion": 1,
  "statement": "When the system asks an engineer for a new node, it shows the nodes already at that level and the words already defined.",
  "sync": {
    "constraintsDigest": "sha256:product-lint-constraints-v1:3f65fd776ba40d763c88391ec813d0f2e4d177fb75aefb87a70a9c33c2419d0f"
  }
}
