{
  "$schema": "../../schema/canonical-node.schema.json",
  "constrainedBy": [
    "product.every-governed-file-has-one-owner"
  ],
  "id": "behavior.an-unowned-file-refuses-the-commit",
  "level": "behavior",
  "schemaVersion": 1,
  "statement": "When an engineer stages a change to a file that no node owns, the system refuses the commit and names the file.",
  "sync": {
    "constraintsDigest": "sha256:product-lint-constraints-v1:921e1bcc2f323ad7d2b628b570891d67aad801fb5ef4cc339ac524710ee7bbde"
  }
}
