{
  "$schema": "../../schema/canonical-node.schema.json",
  "constrainedBy": [
    "product.every-governed-file-has-one-owner"
  ],
  "id": "behavior.two-owners-for-one-file-refuse-the-commit",
  "level": "behavior",
  "schemaVersion": 1,
  "statement": "When two nodes claim one file, the system refuses the commit and names both nodes.",
  "sync": {
    "constraintsDigest": "sha256:product-lint-constraints-v1:bd08eec17cf10c0ec237420e0fdad7ac14662cc7caef932075372160821dabde"
  }
}
