{
  "$schema": "../../schema/canonical-node.schema.json",
  "constrainedBy": [
    "product.the-decisions-for-a-file-are-returned-when-the-file-is-named"
  ],
  "id": "behavior.naming-a-file-lists-its-lineage",
  "level": "behavior",
  "schemaVersion": 1,
  "statement": "When an engineer names a file, the system lists every claim that governs it, from the problem down to the code.",
  "sync": {
    "constraintsDigest": "sha256:product-lint-constraints-v1:cfe5224331a87e7b43ef78e28f463aa199aeffdb64c44e8c836b68a4ac6d117c"
  }
}
